{
  "date": "2026-07-27",
  "generated_at": "2026-07-28T07:07:40.880547+09:00",
  "total_count": 20,
  "news_items": [
    {
      "id": "news-20260727-001",
      "headline": "‘AI 투자 피한’ 애플, 엔비디아 제치고 시총 1위",
      "category": "경제",
      "summary": {
        "overview": "미국 증시에서 애플이 엔비디아를 제치고 세계 시가총액 1위에 올랐다. 또한 인공지능(AI) 투자 경쟁이 장기화하면서 ‘AI 최대 수혜주’였던 엔비디아보다 대규모 설비투자를 피하는 애플을 투자자들이 더 높게 평가하기 시작한 결과라는 분석이 나온다.",
        "narrative": {
          "intro": "미국 증시에서 애플이 엔비디아를 제치고 세계 시가총액 1위에 올랐다.",
          "development": "인공지능(AI) 투자 경쟁이 장기화하면서 ‘AI 최대 수혜주’였던 엔비디아보다 대규모 설비투자를 피하는 애플을 투자자들이 더 높게 평가하기 시작한 결과라는 분석이 나온다.",
          "turn": "27일(현지시간) 뉴욕증시에서 애플 주가는 전 거래일보다 1% 상승하며 시가총액 4조9500억달러를 기록했다.",
          "conclusion": "반면 엔비디아는 5% 하락해 시가총액이 4조7700억달러로 줄었다."
        },
        "details": "본 뉴스는 매일경제, 동아일보, AI타임스, 뉴스핌, 연합뉴스 등 다수의 매체 본문을 직접 크롤링하여 종합 분석하였습니다.",
        "differences": [
          {
            "publisher": "매일경제",
            "point": "미국 증시에서 애플이 엔비디아를 제치고 세계 시가총액 1위에 올랐다."
          },
          {
            "publisher": "동아일보",
            "point": "미국 엔비디아가 지분 인수를 통해 네이버의 3대 주주가 된다."
          },
          {
            "publisher": "AI타임스",
            "point": "중국 CXMT, 상하이 증시 상장 첫날 466% 폭등…중국 시총 1위 등극"
          },
          {
            "publisher": "뉴스핌",
            "point": "[미국 특징주] 엔비디아, 대규모 AI 인프라 딜 추진 소식에 하락…'순환 거래' 우려도"
          }
        ],
        "key_terms": [
          {
            "term": "증시",
            "explanation": "주식이 거래되는 시장으로, 기업의 실적 전망과 경제 지표에 따라 민감하게 반응합니다."
          },
          {
            "term": "AI",
            "explanation": "인공지능(Artificial Intelligence) 기술로, 빅테크 기업들의 투자 경쟁과 산업 생산성 혁신의 핵심 동력입니다."
          },
          {
            "term": "반도체",
            "explanation": "전자기기의 핵심 부품으로, 한국 경제 및 IT 산업의 대표적인 수출 동량 품목입니다."
          },
          {
            "term": "데이터센터",
            "explanation": "대규모 데이터를 저장·처리하는 필수 인프라로, 전력 수급 및 IT 서버 장비 수요와 직결됩니다."
          },
          {
            "term": "트럼프",
            "explanation": "미국 주요 정치 지도자로, 그의 공약이나 발언은 글로벌 통상 및 금융 시장의 주요 변수입니다."
          },
          {
            "term": "관세",
            "explanation": "수입품에 부과되는 세금으로, 무역 정세와 물가 및 기업 수출 전반에 영향을 주는 정책입니다."
          }
        ],
        "impact": "수집된 기사 본문에 따르면, 본 이슈는 산업계의 원가 구조와 시장 수급 관계에 영향을 미치며 시중 금융 지표에 연쇄 효과를 줄 것으로 분석됩니다."
      },
      "publishers": [
        {
          "name": "매일경제",
          "title": "‘AI 투자 피한’ 애플, 엔비디아 제치고 시총 1위",
          "url": "https://www.mk.co.kr/news/it/12109034"
        },
        {
          "name": "매일경제",
          "title": "‘왕의 귀환’ 애플, 엔비디아 제치고 15개월 만에 세계 시총 1위",
          "url": "https://www.mk.co.kr/news/world/12109017"
        },
        {
          "name": "동아일보",
          "title": "엔비디아, 네이버 3대 주주 오른다… 한미 ‘AI 생태계 동맹’ 결속력 강화",
          "url": "https://www.donga.com/news/Economy/article/all/20260728/134375547/2"
        },
        {
          "name": "AI타임스",
          "title": "중국 CXMT, 상하이 증시 상장 첫날 466% 폭등…중국 시총 1위 등극",
          "url": "https://news.google.com/rss/articles/CBMiakFVX3lxTE52azRCZU85NVhWTS1saGVyc1NkVHYxV3NNeS1yQk0xc2FZTEFLMXpsbTllMlVDUWxCU0FSTHBpN0ZjQXJ5MHdzUlBBS1F3cFNqLXFKS2VwRmJfT1ItRTd3eFRLWm85OWFUR3c?oc=5"
        },
        {
          "name": "뉴스핌",
          "title": "[미국 특징주] 엔비디아, 대규모 AI 인프라 딜 추진 소식에 하락…'순환 거래' 우려도",
          "url": "https://news.google.com/rss/articles/CBMiXEFVX3lxTE1uNURITWQwMEpXZWRfeDY4aUo1dUhrc3hOM0tCQXcyLXdsNFVRZ2tVcWFpWjZsc0VKV25qTVVuOU9tQWF4OVlXbXNDZVdQS25tUHoyOHQtQVc1dE9D?oc=5"
        },
        {
          "name": "연합뉴스",
          "title": "애플, 15개월 만에 세계 시총 1위 탈환…AI 투자의 '역설'(종합)",
          "url": "https://www.yna.co.kr/view/AKR20260728006151091"
        }
      ],
      "keywords": [
        "AI",
        "시가총액",
        "1위",
        "지난해",
        "애플은"
      ],
      "image_url": "https://picsum.photos/seed/news-20260727-001/600/400"
    },
    {
      "id": "news-20260727-002",
      "headline": "젤렌스키 “러, 10월초 50만명 동원할 것…북한도 3만명 추가파병”",
      "category": "경제",
      "summary": {
        "overview": "볼로디미르 젤렌스키 우크라이나 대통령이 27일(현지시간) 러시아가 오는 9월 총선 이후 30만∼50만명 규모의 대규모 동원령을 내릴 것이라는 정보기관 보고를 받았다고 밝혔다. 또한 러시아 정부가 ‘러시아가 3만명의 북한군을 수용할 준비를 하고 있다’는 볼로디미르 젤렌스키 우크라이나 대통령의 주장에 대해 논평을 거부했다.",
        "narrative": {
          "intro": "볼로디미르 젤렌스키 우크라이나 대통령이 27일(현지시간) 러시아가 오는 9월 총선 이후 30만∼50만명 규모의 대규모 동원령을 내릴 것이라는 정보기관 보고를 받았다고 밝혔다.",
          "development": "러시아 정부가 ‘러시아가 3만명의 북한군을 수용할 준비를 하고 있다’는 볼로디미르 젤렌스키 우크라이나 대통령의 주장에 대해 논평을 거부했다.",
          "turn": "로이터 통신에 따르면 드미트리 페스코프 크렘린 대변인은 27일(현지시각) 기자들과 만나 젤렌스키 대통령의 북한 추가 파병 발언에 대해 “굳이 논평할 필요가 없다고 생각한다.",
          "conclusion": "우리의 계획에 대해 젤렌스키가 왈가왈부할 일이 아니다”라고 말했다."
        },
        "details": "본 뉴스는 매일경제, 한겨레, 경향신문, 조선일보 등 다수의 매체 본문을 직접 크롤링하여 종합 분석하였습니다.",
        "differences": [
          {
            "publisher": "매일경제",
            "point": "볼로디미르 젤렌스키 우크라이나 대통령이 27일(현지시간) 러시아가 오는 9월 총선 이후 30만∼50만명 규모의 대규모 동원령을 내릴 것이라는 정보기관 보고를 받았다고 밝혔다."
          },
          {
            "publisher": "한겨레",
            "point": "러시아 정부가 ‘러시아가 3만명의 북한군을 수용할 준비를 하고 있다’는 볼로디미르 젤렌스키 우크라이나 대통령의 주장에 대해 논평을 거부했다."
          },
          {
            "publisher": "경향신문",
            "point": "김정은 북한 국무위원장(왼쪽)과 블라디미르 푸틴 러시아 대통령이 중국의 전승절 80주년 열병식을 하루 앞둔 지난해 9월 3일 베이징 댜오위타이 국빈관에서 회담하고 있다."
          },
          {
            "publisher": "조선일보",
            "point": "젤렌스키 \"러, 10월에 50만명 동원할것..."
          }
        ],
        "key_terms": [
          {
            "term": "우크라이나",
            "explanation": "동유럽 국가로, 현재 지정학적 분쟁 및 국제 유가·곡물 가격 등 글로벌 공급망의 주요 변수입니다."
          },
          {
            "term": "트럼프",
            "explanation": "미국 주요 정치 지도자로, 그의 공약이나 발언은 글로벌 통상 및 금융 시장의 주요 변수입니다."
          }
        ],
        "impact": "수집된 기사 본문에 따르면, 본 이슈는 산업계의 원가 구조와 시장 수급 관계에 영향을 미치며 시중 금융 지표에 연쇄 효과를 줄 것으로 분석됩니다."
      },
      "publishers": [
        {
          "name": "매일경제",
          "title": "젤렌스키 “러, 10월초 50만명 동원할 것…북한도 3만명 추가파병”",
          "url": "https://www.mk.co.kr/news/world/12109028"
        },
        {
          "name": "한겨레",
          "title": "러, 젤렌스키 ‘북한군 3만명 추가 파병’ 주장에 논평 거부",
          "url": "https://www.hani.co.kr/arti/international/europe/1270223.html"
        },
        {
          "name": "경향신문",
          "title": "크렘린궁, 젤렌스키 ‘북한군 3만명 추가 수용 준비’ 주장에 논평 거부",
          "url": "https://www.khan.co.kr/article/202607271956001/?utm_source=khan_rss&utm_medium=rss&utm_campaign=kh_world"
        },
        {
          "name": "조선일보",
          "title": "젤렌스키 \"러, 10월에 50만명 동원할것... 北도 3만 추가 파병\"",
          "url": "https://news.google.com/rss/articles/CBMingFBVV95cUxQVW14c3g3Tks0bndWQlF6SVU5Wm5yd2VUNE5JcGhyNl9ZcEQzUGk5UUhnWFV3aDJtT19YYTE4ZEIwbkkydjJXVzFZekRXTktOU1NOZ1k3ZVlIYjJKZ1YzODFHemJWc2FUMk90VEhOcWpkc3NTTldxQXBnMk1TdTI4Z2ZlYVNYWWhfNUVHTVZlQlVTU3dMWTYyMHdsaXZMUQ?oc=5"
        }
      ],
      "keywords": [
        "젤렌스키",
        "러시아",
        "우크라이나",
        "있다",
        "러시아가"
      ],
      "image_url": "https://picsum.photos/seed/news-20260727-002/600/400"
    },
    {
      "id": "news-20260727-003",
      "headline": "트럼프 “이란과 협상 진행 중…합의 실패하면 강력한 군사행동 재개”",
      "category": "세계",
      "summary": {
        "overview": "도널드 트럼프 미국 대통령이 27일(현지시각) 이란과의 협상이 진행 중이며 합의가 성사될 가능성이 있다고 밝혔다. 또한 다만 협상이 신속하게 성과를 내지 못할 경우 대이란 군사행동을 재개하겠다고 경고했다.",
        "narrative": {
          "intro": "도널드 트럼프 미국 대통령이 27일(현지시각) 이란과의 협상이 진행 중이며 합의가 성사될 가능성이 있다고 밝혔다.",
          "development": "다만 협상이 신속하게 성과를 내지 못할 경우 대이란 군사행동을 재개하겠다고 경고했다.",
          "turn": "이란은 미국에 협상을 요청했다는 트럼프 대통령의 주장을 “조작된 것”이라고 반박했다.",
          "conclusion": "트럼프 대통령은 이날 미시간주로 향하는 에어포스원 기내에서 취재진에게 “이란이 만나기를 원했고 우리는 만나고 있다”며 “어떻게 될지 지켜보자”고 말했다."
        },
        "details": "본 뉴스는 한겨레, 경향신문, 연합뉴스, VOA 한국어 홈페이지 등 다수의 매체 본문을 직접 크롤링하여 종합 분석하였습니다.",
        "differences": [
          {
            "publisher": "한겨레",
            "point": "도널드 트럼프 미국 대통령이 27일(현지시각) 이란과의 협상이 진행 중이며 합의가 성사될 가능성이 있다고 밝혔다."
          },
          {
            "publisher": "경향신문",
            "point": "27일(현지시간) 이란 테헤란에서 한 여성이 도널드 트럼프 미국 대통령의 모습이 담긴 대형 광고판 앞으로 지나가고 있다."
          },
          {
            "publisher": "연합뉴스",
            "point": "(워싱턴=연합뉴스) 이유미 특파원 = 도널드 트럼프 미국 대통령은 27일(현지시간) 이란과 협상을 진행 중이며 합의 성사 가능성이 있다고 밝혔다."
          },
          {
            "publisher": "VOA 한국어 홈페이지",
            "point": "미-이란 사흘째 공습 중단, 외교 재개 모색…트럼프 대통령 \"합의 가능성 있어”"
          }
        ],
        "key_terms": [
          {
            "term": "트럼프",
            "explanation": "미국 주요 정치 지도자로, 그의 공약이나 발언은 글로벌 통상 및 금융 시장의 주요 변수입니다."
          },
          {
            "term": "이란",
            "explanation": "중동의 주요 산유국으로, 지정학적 긴장감 및 호르무즈 해협 관련 원유 수급 이슈의 중심에 있습니다."
          },
          {
            "term": "우크라이나",
            "explanation": "동유럽 국가로, 현재 지정학적 분쟁 및 국제 유가·곡물 가격 등 글로벌 공급망의 주요 변수입니다."
          }
        ],
        "impact": "글로벌 보도 본문을 종합할 때, 이는 국제 통상과 지정학적 구도에 직간접적 영향을 주어 국내 외환 및 관련 시장에도 지속적인 변수가 될 전망입니다."
      },
      "publishers": [
        {
          "name": "한겨레",
          "title": "트럼프 “이란과 협상 진행 중…합의 실패하면 강력한 군사행동 재개”",
          "url": "https://www.hani.co.kr/arti/international/america/1270242.html"
        },
        {
          "name": "경향신문",
          "title": "이란 외교부, 미국과 대화 재개 가능성 일축···“미국에 협상 재개 요청한 적 없어”",
          "url": "https://www.khan.co.kr/article/202607272216001/?utm_source=khan_rss&utm_medium=rss&utm_campaign=kh_world"
        },
        {
          "name": "연합뉴스",
          "title": "트럼프 \"이란과 합의 가능성 꽤 있어…실패시 다시 군사행동\"(종합2보)",
          "url": "https://www.yna.co.kr/view/AKR20260728001152071"
        },
        {
          "name": "VOA 한국어 홈페이지",
          "title": "미-이란 사흘째 공습 중단, 외교 재개 모색…트럼프 대통령 \"합의 가능성 있어”",